,,
1023,Correlated Neuronal Response: Time Scales and Mechanisms,"In a previous study of pairs of MT neurons recorded using a single extracellular electrode, it was found that the spike count during two seconds of visual motion stimulation had an average correlation coefficient of r = 0.12 and that this correlation could significantly limit the usefulness of pooling across increasingly large populations of neurons (Zohary et aI., 1994). However, correlated spike count between two neurons could in principle occur at several time-scales. Correlated drifts Correlated Neuronal Response: Time Scales and Mechanisms 69 in the excitability of the cells, for example due to normal biological changes or electrode induced changes, could cause correlation at a time scale of many minutes. Alternatively, attentional or priming effects from higher areas could change the responsivity of the cells at the time scale of an experimental trial. Or, as suggested here, common input that changes on the order of milliseconds could cause correlation in spike count. The first section determines the time scale at which the neurons are correlated by analyzing the relationship between the peak in the spike train cross-correlograms (CCGs) and the correlation between the spike counts using a construct we call the trial CCG. The second section examines temporal structure that is indicative of correlated suppression of firing, perhaps due to inhibition, which may also contribute to the spike count correlation. 2 THE TIME SCALE OF CORRELATION At the time scale of the single trial, the correlation, r se, of spike counts x and y from two neurons recorded during nominally identical two second stimuli was computed using Pearson's correlation coefficient, rse = E[xy] - ExEy , uxuy (1) where E is expected value and u 2 is variance. If spike counts are converted to z-scores, i.e., zero mean and unity variance, then rse = E[xy], and rse may be interpreted as the zero-lag value of the cross-correlation of the z-scored spike counts. The trial CCGs resulting from this procedure are shown for two pairs of neurons in Fig. l. To distinguish between cases like the two shown in Fig. 1, the correlation was broken into a long-term component, rlt, the average value (computed using a Gaussian window of standard deviation 4 trials) surrounding the zero-lag value, and a shortterm component, rst, the difference between the zero-lag value and rlt."
1024,Onset-based Sound Segmentation,"The onset and offset signals are compressed, then clustered both in time and across frequency channels using a network of integrateand-fire neurons. Onsets and offsets are signalled by spikes, and the timing of these spikes used to segment the sound. 1 Background Traditional speech interpretation techniques based on Fourier transforms, spectrum recoding, and a hidden Markov model or neural network interpretation stage have limitations both in continuous speech and in interpreting speech in the presence of noise, and this has led to interest in front ends modelling biological auditory systems for speech interpretation systems (Ainsworth and Meyer 92; Cosi 93; Cole et al 95). Auditory modelling systems use similar early auditory processing to that used in biological systems. Mammalian auditory processing uses two ears, and the incoming signal is filtered first by the pinna (external ear) and the auditory canal before it causes the tympanic membrane (eardrum) to vibrate. This vibration is then passed on through the bones of the middle ear to the oval window on the cochlea. Inside the cochlea, the pressure wave causes a pattern of vibration to occur on the basilar membrane. This appears to be an active process using both the inner and outer hair cells of the organ of Corti. The movement is detected by the inner hair cells and turned into neural impulses by the neurons of the spiral ganglion. These pass down the auditory nerve, and arrive at various parts of the cochlear nucleus. From there, nerve fibres innervate other areas: the lateral and medial nuclei of the superior olive, L.S.SMITH 730 and the inferior colliculus, for example. (See (Pickles 88)). Virtually all modern sound or speech interpretation systems use some form of bandpass filtering, following the biology as far as the cochlea. Most use Fourier transforms to perform a calculation of the energy in each band over some time period, usually between 25 and 75 ms. This is not what the cochlea does. Auditory modelling front ends differ in the extent and length to which they follow animal early auditory processing, but the term generally implies at least that wideband filters are used, and that high temporal resolution is maintained in the initial stages. This means the use of filtering techniques. rather than Fourier transforms in the bandpass stage. Such filtering systems have been implemented by Patterson and Holdsworth (Patterson and Holdsworth 90; Slaney 93), and placed directly in silicon (Lazzaro and Mead 89; Lazzaro et al 93; Liu et al 93; Fragniere and van Schaik 94). Some auditory models have moved beyond cochlear filtering. The inner hair cell has been modelled by either simple rectification (Smith 94) or has been based on the work of (Meddis 88) for example (Patterson and Holdsworth 90; Cosi 93; Brown 92). Lazzaro has experimented with a silicon version of Licklider's autocorrelation processing (Licklider 51; Lazzaro and Mead 89). Others such as (Wu et al 1989: Blackwood et al1990; Ainsworth and Meyer 92; Brown 92; Berthommier 93; Smith 94) have considered the early brainstem nuclei, and their possible contribution, based on the neurophysiology of the different cell types (Pickles 88; Blackburn and Sachs 1989; Kim et al 90). Auditory model-based systems have yet to find their way into mainstream speech recognition systems (Cosi 93). The work presented here uses auditory modelling up to onset cells in the cochlear nucleus. It adds a temporal neural network to clean up the segmentation produced. This part has been filed as a patent (Smith 95). Though the system has some biological plausibility, the aim is an effective data-driven segmentation technique implement able in silicon. 2 Techniques used Digitized sound was applied to an auditory front end, (Patterson and Holdsworth 90), which bandpassed the sound into channels each with bandwidth 24.7{4.37Fr; + I)Hz, where Fe is the centre frequency (in KHz) of the band (Moore and Glasberg 83). These were rectified, modelling the effect of the inner hair cells. The signals produced bear some resemblance to that in the auditory nerve. The real system has far more channels and each nerve channel carries spike-coded information."
1025,A model of transparent motion and non-transparent motion aftereffects,"The model contains two stages of direction selective units. The first stage contains broadly tuned units, while the second stage contains units that are narrowly tuned. The model accounts for the motion aftereffect through adapting units at the first stage and inhibitory interactions at the second stage. The model explains how two populations of dots moving in slightly different directions are perceived as a single population moving in the direction of the vector sum, and how two populations moving in strongly different directions are perceived as transparent motion. The model also explains why the motion aftereffect in both cases appears as non-transparent motion. 1 INTRODUCTION Transparent motion can be studied using displays which contain two populations of moving dots. The dots within each population have the same direction of motion, but directions can differ between the two populations. When the two directions are very similar, subjects report seeing dots moving in the average direction (Williams & Sekuler, 1984). However, when the difference between the two directions gets large, subjects perceive two overlapping sheets of moving dots. This percept is called transparent motion. The occurrence of transparent motion cannot be explained by direction averaging, since that would result in a single direction of perceived motion. Rather than just being a quirk of the human visual system, transparent motion is an important issue in motion processing."
1026,A Model of Auditory Streaming,"The appropriate segmentation and grouping of incoming sensory signals is important in enabling an organism to interact effectively with its environment (Llinas, 1991). The formation of associations between signals, which are considered to arise from the same external source, allows the organism to recognise significant patterns and relationships within the signals from each source without being confused by accidental coincidences between unrelated signals (Bregman, 1990). The intrinsically temporal nature of sound means that in addition to being able to focus on the signal of interest, perhaps of equal significance, is the ability to predict how that signal is expected to progress; such expectations can then be used to facilitate further processing of the signal. It is important to remember that perception is a creative act (Luria, 1980). The organism creates its interpretation of the world in response to the current stimuli, within the context of its current state of alertness, attention, and previous experience. The creative aspects of perception are exemplified in the auditory system where peripheral processing decomposes acoustic stimuli. Since the frequency spectra of complex sounds generally A Model of Auditory Streaming 53 overlap, this poses a complicated problem for the auditory system : which parts of the signal belong together, and which of the subgroups should be associated with each other from one moment to the next, given the extra complication of possible discontinuities and occlusion of sound signals? The process of streaming effectively acts to to associate those sounds emitted from the same source and may be seen as an accomplishment, rather than the breakdown of some integration mechanism (Bregman, 1990). The cognitive model of streaming, proposed by (Bregman, 1990), is based primarily on Gestalt principles such as common fate, proximity, similarity and good continuation. Streaming is seen as a mUltistage process, in which an initial, preattentive process partitions the sensory input, causing successive sounds to be associated depending on the relationship between pitch proximity and presentation rate."
1027,REMAP: Recursive Estimation and Maximization of A Posteriori Probabilities - Application to Transition-Based Connectionist Speech Recognition,"The ultimate goal in speech recognition is to determine the sequence of words that has been uttered. Classical pattern recognition theory shows that the best possible system (in the sense of minimum probability of error) is the one that chooses the word sequence with the maximum a posteriori probability (conditioned on the *Also affiliated with with Faculte Poly technique de Mons, Mons, Belgium REMAP: Recursive Estimation and Maximization of A Posteriori Probabilities 389 evidence). If word sequence i is represented by the statistical model M i , and the evidence (which, for the application reported here, is acoustical) is represented by a sequence X = {Xl, ... , X n , ... , X N }, then we wish to choose the sequence that corresponds to the largest P(MiIX). In (Bourlard & Morgan 1994), summarizing earlier work (such as (Bourlard & Wellekens 1989)), we showed that it was possible to compute the global a posteriori probability P(MIX) of a discriminant form of Hidden Markov Model (Discriminant HMM), M, given a sequence of acoustic vectors X. In Discriminant HMMs, the global a posteriori probability P(MIX) is computed as follows: if r represents all legal paths (state sequences ql, q2, ... , qN) in Mi, N being the length of the sequence, then P(Mi IX) = L P(Mi, ql, q2, ... , qNIX) r = in which ~n represents the specific state hypothesized at time n, from the set Q {ql, ... , q , qk, ... , qK} of all possible HMM states making up all possible models Mi. We can further decompose this into: P(Mi, ql, q2,???, qNIX) = P(ql, q2,???, qNIX)P(Milql, q2,???, qN, X) Under the assumptions stated in (Bourlard & Morgan 1994) we can compute N P(ql, q2,???, qNIX) = II p(qnlqn-l, xn) n=l The Discriminant HMM is thus described in terms of conditional transition probabilities p(q~lq~-l' xn), in which q~ stands for the specific state ql of Q hypothesized at time n and can be schematically represented as in Figure 1. P(IkIIIkI, x) p(/aell/ael, x) P(/aelllkl, x) P(ltIlltI, x) P(ltll/ael, x) Figure 1: An example Discriminant HMM for the word ""cat"". The variable to a specific acoustic observation Xn at time n. X refers Finally, given a state sequence we assume the following approximation: P(Milql, q2,???, qN, X) : : : : P(Milql, q2,???, qN) We can estimate the right side of this last equation from a phonological model (in the case that a given state sequence can belong to two different models). All the required (local) conditional transition probabilities p(q~lq~-l> xn) can be estimated by the Multi-Layer Perceptron (MLP) shown in Figure 2. Recent work at lesl has provided us with further insight into the discriminant HMM, particularly in light of recent work on transition-based models (Konig & Morgan 1994j Morgan et al. 1994). This new perspective has motivated us to further develop the original Discriminant HMM theory. The new approach uses posterior probabilities at both local and global levels and is more discriminant in nature."
1028,Exponentially many local minima for single neurons,"Consider a single artificial neuron with d inputs. The neuron has d weights w E Rd. The output of the neuron for an input pattern x E Rd is y = ?(x? w), where ? : R -+ R is a transfer function. For a given sequence of training examples ((Xt, Yt))I<t<m, each consisting of a pattern Xt E R d and a desired output Yt E R, the goal of the training phase for neural networks consists of minimizing the error function with respect to the weight vector w E Rd. This function is the sum of the losses between outputs of the neuron and the desired outputs summed over all training examples. In notation, the error function is m E(w) = L L(Yt, ?(Xt . w)) , t=1 where L : R x R -+ [0,00) is the loss function. A common example of a transfer function is the logistic function logistic( z) = I+!-' which has the bounded range (0, 1). In contrast, the identity function id(z) = z has unbounded (y - Y)2. Other range. One of the most common loss functions is the square loss L(y, y) examples are the absolute loss Iy - yl and the entropic1oss yin? + (1 - y) In = ::::l We show that for the square loss and the logistic function the error function of a single neuron for n training examples may have Ln / dJ d local minima. More generally, this holds for any loss and transfer function for which the composition of the loss function with the transfer function (in notation L(y, ?(x . w)) is continuous and has bounded range. This Exponentially Many Local Minima for Single Neurons Figure 1: 317 Error Function with 25 Local Minima (16 Visible), Generated by 10 TwoDimensional Examples. proves that for any transfer function with bounded range exponentially many local minima can occur when the loss function is the square loss. The sequences of examples that we use in our proofs have the property that they are nonrealizable in the sense that there is no weight vector W E R d for which the error function is zero, i.e. the neuron cannot produce the desired output for all examples. We show with some minimal assumptions on the loss and transfer functions that for a single neuron there can be no local minima besides the global minimum if the examples are realizable. If the transfer function is the logistic function then it has often been suggested in the literature to use the entropic loss in artificial neural networks in place of the square loss [BW88, WD88, SLF88, Wat92]. In that case the error function of a single neuron is convex and thus has only one minimum even in the non-realizable case. We generalize this observation by defining a matching loss for any differentiable increasing transfer functions ?: 1 ,p-l(y) L</>(y, f)) = (?(z) - y) dz . </>-l(y) The loss is the area depicted in Figure 2a. If ? is the identity function then L</> is the square loss likewise if ? is the logistic function then L</> is the entropic loss."
1029,A Practical Monte Carlo Implementation of Bayesian Learning,"The application of Bayesian learning to neural networks has been pioneered by MacKay (1992), who uses a Gaussian approximation to the posterior weight distribution. However, the Gaussian approximation is poor because of multiple modes in the posterior. Even locally around a mode the accuracy of the Gaussian approximation is questionable, especially when the model is large compared to the amount of training data. Here I present and test a Monte Carlo method (Neal, 1995) which avoids the Gaussian approximation. The implementation is complicated, but the user is not required to have extensive knowledge about the algorithm. Thus, the implementation represents a practical tool for learning in neural nets. 599 A Practical Monte Carlo Implementation of Bayesian Learning 1.1 THE PREDICTION TASK = The training data consists of n examples in the form of inputs x {x(i)} and corresponding outputs y = {y(i)} where i = 1 ... n. For simplicity we consider only real-valued scalar outputs. The network is parametrised by weights w, and hyperparameters h that control the distributions for weights, playing a role similar to that of conventional weight decay. Weights and hyperparameters are collectively termed 0, and the network function is written as F/I (x), although the function value is only indirectly dependent on the hyperparameters (through the weights). Bayes' rule gives the posterior distribution for the parameters in terms of the likelihood, p(ylx, 0), and prior, p(O): p (Olx ,y ) = p(O)p(ylx, O) p(ylx) To minimize the expected squared error on an unseen test case with input we use the mean prediction x(n+l), (1) 2 MONTE CARLO SAMPLING The following implementation is due to Neal (1995). The network weights are updated using the hybrid Monte Carlo method (Duane et al. 1987). This method combines the Metropolis algorithm with dynamical simulation."
103,An Adaptive Network That Learns Sequences of Transitions,"The transition function specifies the current state, St, as a function of the last state and the current input, Ut, (1) In this paper we do not discuss output functions because they are relatively simple. To further simplify discussion, we restrict ourselves to binary input alphabets, although the neural net we describe here can easily be extended to accomodate more complex alphabets. 654 Winter A common engineering problem is to identify and then simulate the functionality of a system from observations of its behavior. Simulation is straightforward when we can actually observe the internal states of a system, since then the function f can be specified by learning simple associations among internal states and external inputs. In robotic systems, for instance, internal states can often be characterized by such parameters as stepper motor settings, strain gauge values, etc., and so are directly accessible. Artificial neural systems have peen found useful in such simulations because they can associate large, possibly noisy state space and input variables with state and output variables (Tolat and Widrow, 1988; Winter, Ryan and Turner, 1987). Unfortunately, in many interesting cases we must base simulations on a limited set of examples of a system's black box behavior because its internal workings are unobservable. The black box description is not, by itself, much use as a simulation tool since usually it cannot be specified without resorting to infinitely large input-output tables. As an alternative we can try to develop a sequential automaton description of the system by observing regularities in its black box behavior. Artificial neural systems can contribute to the development of physical machines dedicated to system identification because i) frequently state representations must be derived from many noisy input variables, ii) data must usually be processed in continuous time and iii) the explicit dynamics of artificial neural systems can be used as a framework for hardware implementations. In this paper we give a brief overview of a neural net, TIN2, which learns and processes state transitions from observations of correct black box behavior when the set of observations is large enough to characterize the black box as an automaton."
1030,Neuron-MOS Temporal Winner Search Hardware for Fully-Parallel Data Processing,"Search for the largest (or the smallest) among a number of input data, Le., the winner-take-all (WTA) action, is an essential part of intelligent data processing such as data retrieval in associative memories [3], vector quantization circuits [4], Kohonen's self-organizing maps [5] etc. In addition to the maximum or minimum search, data sorting also plays an essential role in a number of signal processing such as median filtering in image processing, evolutionary algorithms in optimizing problems [6] and so forth . Usually such data processing is carried out by software running on general purpose computers, but the computation time increases explo- 686 T. SHIBATA, T. NAKAI, T. MORIMOTO, R. KAIHARA, T. YAMASHITA, T. OHMI sively with the increase in the volume of data. In order to build electronic systems having a real-time-response capability, the direct implementation of fully parallel algorithms on the integrated circuits hardware is critically demanded. A variety of WTA [4, 7, 8) circuits have been implemented so far based on analog current-mode circuit technologies. A number of cells, each composed of a current source, competitively share the total current specified by a global current sink and the winner is identified through the current concentration toward the cell via tacit positive feedback mechanisms. The circuit implementations using MOSFET's operating in the subthreshold regime [4, 7) are ideal for large scale integration due to its ultra low power nature. Although they are inherently slow at circuit levels, the performance at a system level is far superior to digital counterparts owing to the flexible computing algorithms of analog. In order to achieve a high speed operation, MOSFET's biased at strong inversion is also utilized in Ref. [8). However, cost must be traded off for increased power."
1031,Dynamics of Attention as Near Saddle-Node Bifurcation Behavior,"Most studies of attention have focused on the selection process of incoming sensory cues (Posner et al., 1980; Koch et al., 1985; Desimone et al., 1995). Emphasis was placed on the phenomena of causing different percepts for the same sensory stimuli. However, the selection of sensory input itself is not the final goal of attention. We consider attention as a means for goal-directed behavior and survival of the animal. In this view, dynamical properties of attention are crucial. While attention has to be maintained long enough to enable robust response to sensory input, it also has to be shifted quickly to a novel cue that is potentially important. Long-term maintenance and quick transition are critical requirements for attention dynamics. ?currently at Dept. of Cognitive Science and Institute for Neural Computation, U. C. San Diego, La Jolla CA 92093-0515. hnakahar@cogsci.ucsd.edu 39 Dynamics of Attention as Near Saddle-node Bifurcation Behavior We investigate a possible neural mechanism that enables those dynamical characteristics of attention. First, we analyze the dynamics of a network of sigmoidal units with self-connections. We show that both long-term maintenance and quick transition can be achieved when the system parameters are near a ""saddle-node bifurcation"" point . Then, we test if such a dynamical mechanism can actually be helpful for an autonomously behaving agent in simulations of a 'bug-eat-food' task. The result indicates that near saddle-node bifurcation behavior can emerge in the course of evolution for survival in non-stationary environments. 2 NEAR SADDLE-NODE BIFURCATION BEHAVIOR When a pulse-like input is given to a linear system, the rising and falling phases of the response have the same time constants. This means that long-term maintenance and quick transition cannot be simultaneously achieved by linear dynamics. Therefore, it is essential to consider a nonlinear dynamical mechanism to achieve these two demands. 2.1 DYNAMICS OF A SELF-RECURRENT UNIT First, we consider the dynamics of a single sigmoidal unit with the self-connection weight a and the bias b. y(t + 1) F(ay(t) + b) , (1) F(x) 1 1 + exp( -x)' (2) The parameters (a, b) determine the qualitative behavior of the system such as the number of fixed points and their stabilities."
