,,
1007,Learning to Play the Game of Chess,"This illustrates the hardness of the problem of learning to play chess from the final outcome of games. This paper presents NeuroChess, a program that learns to play chess from the final outcome of games. The central learning mechanisms is the explanation-based neural network (EBNN) algorithm [9, 8]. Like Tesauro's TD-Gammon approach, NeuroChess constructs a neural network evaluation function for chess boards using TO. In addition, a neural network version of explanation-based learning is employed, which analyzes games in terms of a previously learned neural network chess model. This paper describes the NeuroChess approach, discusses several training issues in the domain of chess, and presents results which elucidate some of its strengths and weaknesses. 2 Temporal Difference Learning in the Domain of Chess Temporal difference learning (TO) [14] comprises a family of approaches to prediction in cases where the event to be predicted may be delayed by an unknown number of time steps. In the context of game playing, TD methods have frequently been applied to learn functions which predict the final outcome of games. Such functions are used as board evaluation functions. in which the opponent's knight attacks our queen and king simultaneously. Suppose in order to save our king we have to move it, and hence sacrifice our queen. Explanation-based methods (EBL) [5, 7, 15] generalize more accurately from less training data. They rely instead on the availability of domain knowledge, which they use for explaining and generalizing training examples. They can be interpreted as biasing the network V based on chess-specific domain knowledge, embodied in M . For the relation ofEBNN and EBL and the accommodation of inaccurate slopes in EBNN see [8]. 4 Training Issues In this section we will briefly discuss some training issues that are essential for learning good evaluation functions in the domain of chess. This list of points has mainly been produced through practical experience with the NeuroChess and related TD approaches. It illustrates the importance of a careful design of the input representation, the sampling rule and the Learning to Play the Game of Chess 1073 parameter setting in a domain as complex as chess. Sampling. The vast majority of chess boards are, loosely speaking, not interesting. If, for example, the opponent leads by more than a queen and a rook, one is most likely to loose. Without an appropriate sampling method there is the danger that the learner spends most of its time learning from uninteresting examples. Therefore, NeuroChess interleaves selfplay and expert play for guiding the sampling process. More specifically, after presenting a random number of expert moves generated from a large database of grand-master games, NeuroChess completes the game by playing itself. This sampling mechanism has been found to be of major importance to learn a good evaluation function in a reasonable amount of time. Quiescence. In the domain of chess certain boards are harder to evaluate than others. For example, in the middle of an ongoing material exchange, evaluation functions often fail to produce a good assessment. Thus, most chess programs search selectively. A common criterion for determining the depth of search is called quiescence. This criterion basically detects material threats and deepens the search correspondingly. NeuroChess' search engine does the same. Consequently, the evaluation function V is only trained using quiescent boards. Smoothness. Obviously, using the raw, canonical board description as input representation is a poor choice. This is because small changes on the board can cause a huge difference in value, contrasting the smooth nature of neural network representations. Therefore, NeuroChess maps chess board descriptions into a set of board features . These features were carefully designed by hand. Discounting. Software architecture. Training is performed completely asynchronously on up to 20 workstations simultaneously. One of the workstations acts as a weight server, keeping track of the most recent weights and biases of the evaluation network. The other workstations can dynamically establish links to the weight server and contribute to the process of weight refinement. The main process also monitors the state of all other workstations and restarts processes when necessary. Four moves later black is mate. This game is prototypical. As can be seen from this and various other games, NeuroChess has learned successfully to protect its material, to trade material, and to protect its king. It has not learned, however, to open a game in a coordinated way, and it also frequently fails to play short.endgames even if it has a material advantage (this is due to the short planning horizon). Most importantly, it still plays incredibly poor openings, which are often responsible for a draw or a loss. Poor openings do not surprise, however, as TD propagates values from the end of a game to the beginning. Table I shows a performance comparison of NeuroChess versus GNU-Chess, with and without the explanation-based learning strategy. This table illustrates that NeuroChess wins approximately 13% of all games against GNU-Chess, if both use the same search engine. It 'This is because in the current version NeuroChess still heavily uses expert games for sampling. Whenever a grand-master moves its queen to the center of the board, the queen is usually safe, and there is indeed a positive correlation between having the queen in the center and winning in the database. The latter component analyzes games using knowledge that was previously learned from expert play. Particular care has been taken in the design of an appropriate feature representation, sampling methods, and parameter settings. Thus far, NeuroChess has successfully managed to beat GNU-Chess in several hundreds of games. However, the level of play still compares poorly to GNU-Chess and human chess players. Despite the initial success, NeuroChess faces two fundamental problems which both might weB be in the way of excellent chess play. Firstly, training time is limited, and it is to be expected that excellent chess skills develop only with excessive training time. This is particularly the case if only the final outcomes are considered. Secondly, with each step of TO-learning NeuroChess loses information. This is partially because the features used for describing chess boards are incomplete, i.e., knowledge about the feature values alone does not suffice to determine the actual board exactly. But, more importantly, neural networks have not the discriminative power to assign arbitrary values to all possible feature combinations. It is therefore unclear that a TD-like approach will ever, for example, develop good chess openmgs. Another problem of the present implementation is related to the trade-off between knowledge and search. It has been well recognized that the ul timate cost in chess is determi ned by the ti me it takes to generate a move. Chess programs can generally invest their time in search, or in the evaluation of chess boards (search-knowledge trade-off) [3] . Currently, NeuroChess does a poor job, because it spends most of its time computing board evaluations. Computing a large neural network function takes two orders of magnitude longer than evaluating an optimized linear evaluation function (like that of GNU-Chess). VLSI neural network technology offers a promising perspective to overcome this critical shortcoming of sequential neural network simulations. 1076 Sebastian Thrun Acknowledgment The author gratefully acknowledges the guidance and advise by Hans Berliner, who provided the features for representing chess boards, and without whom the current level of play would be much worse. He also thanks Tom Mitchell for his suggestion on the learning methods, and Horst Aurisch for his help with GNU-Chess and the database."
1008,An experimental comparison of recurrent neural networks,"Introduction In the past few years several recurrent neural network architectures have emerged. In this paper we categorize various discrete-time recurrent neural network architectures, and perform a quantitative comparison of these architectures on two problems: grammatical inference and nonlinear system identification. 2 RNN Architectures We broadly divide these networks into two groups depending on whether or not the states of the network are guaranteed to be observable. A network with observable states has the property that the states of the system can always be determined from observations of the input and output alone. The archetypical model in this class .. Also with UMIACS, University of Maryland, College Park, MD 20742 698 Bill G. Horne, C. Lee Giles Table 1: Terms that are weighted in various single layer network architectures. Ui represents the ith input at the current time step, Zi represents the value of the lh node at the previous time step. Architecture First order High order Bilinear Quadratic bias x x Ui Zi x x x x x x UiUj ZiUj ZiZj x x x x x was proposed by Narendra and Parthasarathy [9]. In their most general model, the output of the network is computed by a multilayer perceptron (MLP) whose inputs are a window of past inputs and outputs, as shown in Figure la. A special case of this network is the Time Delay Neural Network (TDNN), which is simply a tapped delay line (TDL) followed by an MLP [7]. This network is not recurrent since there is no feedback; however, the TDL does provide a simple form of dynamics that gives the network the ability model a limited class of nonlinear dynamic systems. A variation on the TDNN, called the Gamma network, has been proposed in which the TDL is replaced by a set of cascaded filters [2]."
101,Training Multilayer Perceptrons with the Extended Kalman Algorithm,"This algorithm converges slowly for large or complex problems such as speech recognition, where thousands of iterations may be needed for convergence even with small data sets. In this paper, we show that training multilayer perceptrons is an identification problem for a nonlinear dynamic system which can be solved using the Extended Kalman Algorithm. Although computationally complex, the Kalman algorithm usually converges in a few iterations. We describe the algorithm and compare it with back-propagation using twodimensional examples. INTRODUCTION Multilayer perceptrons are one of the most popular artificial neural net structures being used today. In most applications, the ""back propagation"" algorithm [Rllmelhart et ai, 1986] is used to train these networks. Although this algorithm works well for small nets or simple problems, convergence is poor if the problem becomes complex or the number of nodes in the network become large [Waibel et ai, 1987]. In problems sllch as speech recognition, tens of thousands of iterations may be required for convergence even with relatively small elata-sets. Thus there is much interest [Prager anel Fallsiele, 1988; Irie and Miyake, 1988] in other ""training algorithms"" which can compute the parameters faster than back-propagation anel/or can handle much more complex problems. In this paper, we show that training multilayer perceptrons can be viewed as an identification problem for a nonlinear dynamic system. For linear dynamic Copyright 1989. Bell Communications Research. Inc. 134 Singhal and Wu systems with white input and observation noise, the Kalman algorithm [Kalman, 1960] is known to be an optimum algorithm. Extended versions of the Kalman algorithm can be applied to nonlinear dynamic systems by linearizing the system around the current estimate of the parameters."
1010,Interference in Learning Internal Models of Inverse Dynamics in Humans,"Introduction In tasks where we use our hands to interact with a tool, our motor system develops a model of the dynamics of that tool and uses this model to control the coupled dynamics of our arm and the tool (Shadmehr and Mussa-Ivaldi 1994). In physical systems theory, the tool is a mechanical analogue of an admittance, mapping a force as input onto a change in state as output (Hogan 1985). In this framework, the ?Currently at Dept. Biomedical Eng, Johns Hopkins Univ, Baltimore, MD 21205 tCurrently at Dept. Physiology, Northwestern Univ Med Sch (M211), Chicago, IL 60611 1118 Reza Shadmehr, Tom Brashers-Krug, Ferdinando Mussa-Ivaldi Figure 1: The experimental setup. The robot is a very low friction planar mechanism powered by two torque motors that act on the shoulder and elbow joints. Subject grips the end-point of the robot which houses a force transducer and moves the hand to a series of targets displayed on a monitor facing the subject (not shown) . The function of the robot is to produce novel force fields that the subject learns to compensate for during reaching movements. model developed by the motor control system during the learning process needs to approximate an inverse of this mapping . This inverse dynamics map is called an internal model of the tool. We have been interested in understanding the representations that the nervous system uses in learning and storing such internal models. In a previous work we measured the way a learned internal model extrapolated beyond the training data (Shadmehr and Mussa-Ivaldi 1994). The results suggested that the coordinate system of the learned map was in intrinsic (e.g., joint or muscles based) rather than in extrinsic (e.g., hand based) coordinates. Here we present a mathematical technique to estimate the input-output properties of the learned map."
1011,Active Learning with Statistical Models,"ACTIVE LEARNING - BACKGROUND An active learning problem is one where the learner has the ability or need to influence or select its own training data. Many problems of great practical interest allow active learning, and many even require it. We consider the problem of actively learning a mapping X - Y based on a set of training examples {(Xi,Yi)}~l' where Xi E X and Yi E Y. The learner is allowed to iteratively select new inputs x (possibly from a constrained set), observe the resulting output y, and incorporate the new examples (x, y) into its training set. The primary question of active learning is how to choose which x to try next. There are many heuristics for choosing x based on intuition, including choosing places where we don't have data, where we perform poorly [Linden and Weber, 1993], where we have low confidence [Thrun and Moller, 1992], where we expect it 706 David Cohn, Zoubin Ghahramani, Michael I. Jordon to change our model [Cohn et aI, 1990], and where we previously found data that resulted in learning [Schmidhuber and Storck, 1993]. In this paper we consider how one may select x ""optimally"" from a statistical viewpoint. We first review how the statistical approach can be applied to neural networks, as described in MacKay [1992] and Cohn [1994]. We then consider two alternative, statistically-based learning architectures: mixtures of Gaussians and locally weighted regression. While optimal data selection for a neural network is computationally expensive and approximate, we find that optimal data selection for the two statistical models is efficient and accurate. 2 ACTIVE LEARNING - A STATISTICAL APPROACH We denote the learner's output given input x as y(x). The mean squared error of this output can be expressed as the sum of the learner's bias and variance. The variance 0'3 (x) indicates the learner's uncertainty in its estimate at x. 1 Our goal will be to select a new example x such that when the resulting example (x, y) is added to the training set, the integrated variance IV is minimized: IV = J0'3 P (x)dx. (1) Here, P(x) is the (known) distribution over X. In practice, we will compute a Monte Carlo approximation of this integral, evaluating 0'3 at a number of random points drawn according to P(x). Selecting x so as to minimize IV requires computing 0-3, the new variance at x given (x, y). Until we actually commit to an x, we do not know what corresponding y we will see, so the minimization cannot be performed deterministically.2 Many learning architectures, however, provide an estimate of PWlx) based on current data, so we can use this estimate to compute the expectation of 0-3. Selecting x to minimize the expected integrated variance provides a solid statistical basis for choosing new examples."
1012,A Rapid Graph-based Method for Arbitrary Transformation-Invariant Pattern Classification,"INTRODUCTION In recent years, the crucial issue of incorporating invariances into networks for pattern recognition has received increased attention, most especially due to the work of 666 Alessandro Sperduti, David G. Stork Simard and his colleagues. To a regular hierachical backpropagation network Simard et al. [1992] added a Jacobian network, which insured that directional derivatives were also learned. Such derivatives represented directions in feature space corresponding to the invariances of interest, such as rotation, translation, scaling and even line thinning. On small training sets for a function approximation problem, this hybrid network showed performance superior to that of a highly tuned backpropagation network taken alone; however there was negligible improvement on large sets. In order to find a simpler method applicable to real-world problems, Simard, Le Cun & Denker [1993] later used a variation of the nearest neighbor algorithm, one incorporating ""tangent distance"" (T-distance or D T ) as the classification metric - the smallest Euclidean distance between patterns after the optimal transformation. In this way, state-of-the-art accuracy was achieved on an isolated handwritten character task, though at quite high computational complexity, owing to the inefficient search and large number of Euclidean and tangent distances that had to be calculated. Whereas Simard, Hastie & Saeckinger [1994] have recently sought to reduce this complexity by means of pre-clustering stored prototypes, we here take a different approach, one in which a (graph) data structure formed during learning contains information about transformations and geometrical relations among prototypes. Nevertheless, it should be noted that our method can be applied to a reduced (clustered) training set such as they formed, yielding yet faster recognition. Simard [1994] recently introduced a hierarchical structure of successively lower resolution patterns, which speeds search only if a minority of patterns are classified more accurately by using the tangent metric than by other metrics. In contrast, our method shows significant improvement even if the majority or all of the patterns are most accurately classified using the tangent distance. Other methods seeking fast invariant classification include Wilensky and Manukian's scheme [1994]. While quite rapid during recall, it is more properly considered distortion (rather than coherent transformation) invariant. Moreover, some transformations such as line thinning cannot be naturally incorporated into their scheme. Finally, it appears as if their scheme scales poorly (compared to tangent metric methods) as the number of invariances is increased. It seems somewhat futile to try to improve significantly upon the recognition accuracy of the tangent metric approach - for databases such as NIST isolated handwritten characters, Simard et al. [1993] reported accuracies matching that of humans! Nevertheless, there remains much that can be done to increase the computational efficiency during recall. This is the problem we address. 2 TRANSFORMATION INVARIANCE In broad overview, during learning our method constructs a labelled graph data structure in which each node represents a stored prototype (labelled by its category) as given by a training set, linked by arcs representing the T-distance between them. Search through this graph (for classification) takes advantage of the graph structure and an improved search criterion. To understand the underlying computations, we must first consider tangent space. Graph-Based Method for Arbitrary Transformation-Invariant Pattern Classification 667 Figure 1: Geometry of tangent space. Here, a three-dimensional feature space contains the ""current"" prototype, Pc, and the subspace consisting of all patterns obtainable by performing continuous transformations of it (shaded). Two candidate prototypes and a test pattern, T, as well as their projections onto the T-space of Pc are shown. The insert (above) shows the progression of search through the corresponding portion of the recognition graph."
1013,Ocular Dominance and Patterned Lateral Connections in a Self-Organizing Model of the Primary Visual Cortex,"The model suggests new computational roles for lateral connections in the cortex, and suggests that the visual cortex maybe maintained in a continuously adapting equilibrium with the visual input by co adapting lateral and afferent connections. 2 The LISSOM Model of Receptive Fields and Ocular Dominance The LISSOM network is a sheet of interconnected neurons (figure 1). Through afferent connections, each neuron receives input from two ""retinas"". In addition, each neuron has reciprocal excitatory and inhibitory lateral connections with other neurons. Lateral excitatory connections are short-range, connecting only close neighbors. Lateral inhibitory connections run for long distances, and may even implement full connectivity between neurons in the network. Neurons receive afferent connections from broad overlapping patches on the retina called anatomical receptive fields, or RFs. The N x N network is projected on to each retina of R x R receptors, and each neuron is connected to receptors in a square area of side s around the projections. Thus, neurons receive afferents from corresponding regions of each retina. Depending on the location of the projection, the number of afferents to a neuron from each retina could vary from x ~s (at the comers) to s x s (at the center). ts The external and lateral weights are organized through an unsupervised learning process. At each training step, neurons start out with zero activity. The initial response TJij of neuron (i, j) Ocular Dominance and Patterned Lateral Connections Loft _ . . 111 fllgIIl Roll . . Figure 1: The Receptive-Field LISSOM architecture. The afferent and lateral connectionsof a single neuron in the liSSOM network are shown. All connection weights are positive. is based on the scalar product TJij = (T (L eabJJij ,ab + a,b L (1) eCdJJij,Cd) , c,d where eab and ecd are the activations of retinal receptors (a, b) and (c, d) within the receptive fields of the neuron in each retina, JJij,ab and JJij,cd are the corresponding afferent weights, and (T is a piecewise linear approximation of the familiar sigmoid activation function. The response evolves over time through lateral interaction. At each time step, the neuron combines the above afferent activation I:: eJJ with lateral excitation and inhibition: TJij(t) = (T (L eJJ + L ""Ie Eij,kITJkl(t - 1) - L ""Ii k,1 Iij,klTJkl(t - 1)) , (2) k,1 where Eij,kl is the excitatory lateral connection weight on the connection from neuron (k, l) to neuron (i, j), Iij,kl is the inhibitory connection weight, and TJkl (t - 1) is the activity of neuron (k, I) during the previous time step. The constants ""Ie and ""Ii determine the relative strengths of excitatory and inhibitory lateral interactions. The activity pattern starts out diffuse and spread over a substantial part of the map, and converges iteratively into stable focused patches of activity, or activity bubbles."
