,,
ID,title,paper_text
1,Self-Organization of Associative Database and Its Applications,"INTRODUCTION Let a mapping f : X -+ Y be given. Here, X is a finite or infinite set, and Y is another finite or infinite set. A learning machine observes any set of pairs (x, y) sampled randomly from X x Y. (X x Y means the Cartesian product of X and Y.) And, it computes some estimate j : X -+ Y of f to make small, the estimation error in some measure. Usually we say that: the faster the decrease of estimation error with increase of the number of samples, the better the learning machine. However, such expression on performance is incomplete. Since, it lacks consideration on the candidates of J of j assumed preliminarily. Then, how should we find out good learning machines? To clarify this conception, let us discuss for a while on some types of learning machines. And, let us advance the understanding of the self-organization of associative database . Recently, even hardware units computing coefficients in parallel for speed-up are sold, e.g., ANZA, Mark III, Odyssey and E-1. Hence, contrarily to the parameter type, the recursive type guarantees surely that j approaches to 1 as the number of samples increases. The recursive type, if observes a sample (x"" yd, rewrites values 1,-l(X),S to I,(x)'s for some x's correlated to the sample. Hence, this type has an architecture composed of a rule for rewriting and a free memory space. Such architecture forms naturally a kind of database that builds up management systems of data in a self-organizing way. However, this database differs from ordinary ones in the following sense. It does not only record the samples already observed, but computes some estimation of l(x) for any x E X. We call such database an associative database. The first subject in constructing associative databases is how we establish the rule for rewri ting. Furthermore, let t = 1. Step 2: Increase t by 1, and put x, in. After reset a pointer n to the root, repeat the following until n arrives at some terminal node, i.e., leaf. Notations nand d(xt, x[n)), let n n mean the descendant nodes of n. =n. Otherwise, let n =n. If d(x"" r[n)) ~ Step 3: Display yIn] as the related information. Next, put y, in. If yIn] = y"" back to step 2. Otherwise, first establish new descendant nodes n and n.Here, the loop of step 2-3 can be stopped at any time and also can be continued. Now, suppose that gate elements, namely, artificial ""synapses"" that play the role of branching by d are prepared. Then, we obtain a new style of neural network with gate elements being randomly connected by this algorithm. LETTER RECOGNITION Recen tly, the vertical slitting method for recognizing typographic English letters3 , the elastic matching method for recognizing hand written discrete English letters4 , the global training and fuzzy logic search method for recognizing Chinese characters written in square styleS, etc. are published. The self-organization of associative database realizes the recognition of handwritten continuous English letters. The letter recognizer uses a parallelogram window that at least can cover the maximal letter (Fig. 2), and processes the sequence of letters while shifting the window. That is, the recognizer scans a word in a slant direction. And, it places the window so that its left vicinity may be on the first black point detected. Then, the window catches a letter and some part of the succeeding letter. If recognition of the head letter is performed, its end position, namely, the boundary line between two letters becomes known. Hence, by starting the scanning from this boundary and repeating the above operations, the recognizer accomplishes recursively the task. Thus the major problem comes to identifying the head letter in the window. Considering it, we define the following. ? Regard window images as x's, and define X accordingly. ? For a (x, x) E X x X, denote by B a black point in the left area from the boundary on window image X. Project each B onto window image x. Then, measure the Euclidean distance 6 between fj and a black point B on x being the closest to B. Let d(x, x) be the summation of 6's for all black points B's on x divided by the number of B's. ? Regard couples of the ""reading"" and the position of boundary as y's, and define Y accordingly. An operator teaches the recognizer in interaction the relation between window image and reading& boundary with algorithm 3. Precisely, if the recalled reading is incorrect, the operator teaches a correct reading via the console. Moreover, if the boundary position is incorrect, he teaches a correct position via the mouse. Fig. 1 shows partially a document image used in this experiment. This task is automatic excepting the periodic reset of counter, namely, it is a kind of learning without teacher. We define the identification rate by the relative frequency of correct recalls of position data in the past 100 trials. In a typical example, it converged to about 83% around time 400. At time 400, the number of levels was 202, and the levels oftree were distributed in 522. Since the identification failures of 17% can be rejected by considering the trajectory, no pro blem arises in practical use. In order to improve the identification rate, the compression ratio of camera images must be loosened. Such possibility depends on improvement of the hardware in the future. shows an example of actual motion of the robot based on the database for obstacle avoiding movement and that for position identification."
100,Storing Covariance by the Associative Long-Term Potentiation and Depression of Synaptic Strengths in the Hippocampus,"683 A MEAN FIELD THEORY OF LAYER IV OF VISUAL CORTEX AND ITS APPLICATION TO ARTIFICIAL NEURAL NETWORKS* Christopher L. Scofield Center for Neural Science and Physics Department Brown University Providence, Rhode Island 02912 and Nestor, Inc., 1 Richmond Square, Providence, Rhode Island, 02906. ABSTRACT A single cell theory for the development of selectivity and ocular dominance in visual cortex has been presented previously by Bienenstock, Cooper and Munrol. This has been extended to a network applicable to layer IV of visual cortex 2 . In this paper we present a mean field approximation that captures in a fairly transparent manner the qualitative, and many of the quantitative, results of the network theory. Finally, we consider the application of this theory to artificial neural networks and show that a significant reduction in architectural complexity is possible. A SINGLE LAYER NETWORK AND THE MEAN FIELD APPROXIMATION We consider a single layer network of ideal neurons which receive signals from outside of the layer and from cells within the layer. This assumption does not imply that each cell in the network is selective to the same pattern, (and thus that mi = mj). Rather, the assumption is that the vector sum is a constant This amounts to assuming that each cell in the network is surrounded by a population of cells which represent, on average, all possible pattern preferences. Thus the vector sum of the afferent synaptic states describing these pattern preferences is a constant independent of location. Here, in a manner similar to that in the theory of magnetism, we have replaced the effect of individual cortical cells by their average effect (as though all other cortical cells can be replaced by an 'effective' cell, figure 2). Note that we have retained all orders of synaptic traversal of the signal d. Thus, we now focus on the activity of the layer after 'relaxation' to equilibrium. In the mean field approximation we can therefore write (5) where the mean field a with =am 686 and we asume that inhibitory). Afferent Signals d Lo < 0 (the network is, on average, > Figure 2: The single layer mean field network. Detailed connectivity between all cells of the network is replaced with a single (nonmodifiable) synapse from an 'effective' cell. LEARNING IN THE CORTICAL NETWORK We will first consider evolution of the network according to a synaptic modification rule that has been studied in detail, for single cells, elsewhere!? 3. We consider the LGN - cortical synapses to be the site of plasticity and assume for maximum simplicity that there is no modification of cortico-cortical synapses. Then (6) . Lij = O. In what follows c denotes the spatial average over cortical cells, while Cj denotes the time averaged activity of the i th cortical cell. The function cj> has been discussed extensively elsewhere. Here we note that cj> describes a function of the cell response that has both hebbian and anti-hebbian regions. 687 This leads to a very complex set of non-linear stochastic equations that have been analyzed partially elsewhere 2 . In general, the afferent synaptic state has fixed points that are stable and selective and unstable fixed points that are nonselective!, 2. These arguments may now be generalized for the network. In the mean field approximation (7) The mean field, a has a time dependent component m. This varies as the average over all of the network modifiable synapses and, in most environmental situations, should change slowly compared to the change of the modifiable synapses to a single cell. Then in this approximation we can write ? (mi(a)-a) = cj>[mi(a) - a] d. (8) We see that there is a mapping mi' <-> mica) - a (9) such that for every mj(a) there exists a corresponding (mapped) point mj' which satisfies the original equation for the mean field zero theory. It can be shown 2, 4 that for every fixed point of mj( a = 0), there exists a corresponding fixed point mj( a) with the same selectivity and stability properties. The fixed points are available to the neurons if there is sufficient inhibition in the network (ILo I is sufficiently large). APPLICATION OF THE MEAN FIELD NETWORK TO LAYER IV OF VISUAL CORTEX Neurons in the primary visual cortex of normal adult cats are sharply tuned for the orientation of an elongated slit of light and most are activated by stimulation of either eye. Both of these properties--orientation selectivity and binocularity--depend on the type of visual environment experienced during a critical 688 period of early postnatal development. For example, deprivation of patterned input during this critical period leads to loss of orientation selectivity while monocular deprivation (MD) results in a dramatic shift in the ocular dominance of cortical neurons such that most will be responsive exclusively to the open eye. The ocular dominance shift after MD is the best known and most intensively studied type of visual cortical plasticity. Further, the Hopfield model allows a storage capacity which is limited to m < N memories 8, 9. This is a result of the proliferation of unwanted local minima in the 'energy' surface. Recently, Bachmann et al. l 0, have proposed a model for the relaxation of network activity in which memories of activity patterns are the sites of negative 'charges', and the activity caused by a test pattern is a positive test 'charge'. L is a parameter related to the network size. Importantly, this measure is the same for all cells; it is as if a single virtual cell was computing the distance in activity space between the current state and stored states. The result of the computation is This is a then broadcast to all of the cells in the network. generalization of the idea that the detailed activity of each cell in the network need not be fed back to each cell. Rather some global measure, performed by a single 'effective' cell is all that is sufficient in the feedback. DISCUSSION We have been discussing a formalism for the analysis of networks of ideal neurons based on a mean field approximation of the detailed activity of the cells in the network. We find that a simple assumption concerning the spatial distribution of the pattern preferences of the cells allows a great simplification of the analysis. In particular, the detailed activity of the cells of the network may be replaced with a mean field that in effect is computed by a single 'effective' cell."
1000,Bayesian Query Construction for Neural Network Models,"INTRODUCTION In this paper we consider the situation where data collection is costly, as when for example, real measurements or technical experiments have to be performed. In this situation the approach of query learning ('active data selection', 'sequential experimental design', etc.) has a potential benefit. Depending on the previously seen examples, a new input value ('query') is selected in a systematic way and the corresponding output is obtained. The motivation for query learning is that random examples often contain redundant information, and the concentration on non-redundant examples must necessarily improve generalization performance. We use a Bayesian decision-theoretic framework to derive a criterion for query construction. The criterion reflects the intended use of the predictions by an appropriate 444 Gerhard Paass. Jorg Kindermann loss function. We limit our analysis to the selection of the next data point, given a set of data already sampled. The proposed procedure derives the expected loss for candidate inputs and selects a query with minimal expected loss. There are several published surveys of query construction methods [Ford et al. 89, Plutowski White 93, Sollich 94]. Most current approaches, e.g. [Cohn 94], rely on the information matrix of parameters. Then however, all parameters receive equal attention regardless of their influence on the intended use of the model [Pronzato Walter 92]. In addition, the estimates are valid only asymptotically. Bayesian approaches have been advocated by [Berger 80], and applied to neural networks [MacKay 92]. In [Sollich Saad 95] their relation to maximum information gain is discussed. In this paper we show that by using Markov Chain Monte Carlo methods it is possible to determine all quantities necessary for the selection of a query. This approach is valid in small sample situations, and the procedure's precision can be increased with additional computational effort. With the square loss function, the criterion is reduced to a variant of the familiar integrated mean square error [Plutowski White 93]. In the next section we develop the query selection criterion from a decision-theoretic point of view. In the third section we show how the criterion can be calculated using Markov Chain Monte Carlo methods and we discuss a strategy for model selection. In the last section, the results of two experiments with MLPs are described. 2 A DECISION-THEORETIC FRAMEWORK Assume we have an input vector x and a scalar output y distributed as y """" p(y I x, w) where w is a vector of parameters. The conditional expected value is a deterministic function !(x, w) := E(y I x, w) where y = !(x, w)+? and ? is a zero mean error term. Suppose we have iteratively collected observations D(n) := ((Xl, iii), .. . , (Xn, Yn)). We get the Bayesian posterior p(w I D(n)) = p(D(n) Iw) p(w)/ J p(D(n) Iw) p(w) dw and the predictive distribution p(y I x, D(n)) = p(y I x, w)p(w I D(n)) dw if p(w) is the prior distribution. J We consider the situation where, based on some data x, we have to perform an action a whose result depends on the unknown output y. Some decisions may have more severe effects than others. The loss function L(y, a) E [0,00) measures the loss if y is the true value and we have taken the action a E A. In this paper we consider real-valued actions.Together with its still unknown y-value, x defines a new observation (x, y) and new data Den) U (x, y). To determine this risk for some given x we have to perform the following conceptual steps for a candidate query x: 1. Averaging: Integrate this quantity over the future trial inputs x distributed as p(x) and the different possible future outputs y, yielding 1';:= Ir;,x(x)p(x)p(ylx,Den)dxdy. This procedure is repeated until an x with minimal average risk is found. Since local optima are typical, a global optimization method is required. Subsequently we then try to determine whether the current model is still adequate or whether we have to increase its complexity (e.g. by adding more hidden units). Considering the substantial computing effort this favors the current loss criterion. The dots indicate the RMSE for randomly generated data (averaged over 8 experiments) using the same Bayesian prediction procedure. Because only few data points were located in the critical region of high variation the RMSE is much larger.We selected the query point with maximal current loss and determined the final query point with a hillclimbing algorithm. In this way we were rather sure to get close to the true global optimum. The main result of the experiment is summarized in the right part of MLP target function and root mean square error. shows - averaged over 3 experiments - the root mean square error between the true mean value and the posterior mean E(y I x) on the grid of 1681 inputs in relation to the sample size. Three phases of the exploration can be distinguished (see figure 3). In the beginning a search is performed with many queries on the border of the input area. After about 20 observations the algorithm knows enough detail about the true function to concentrate on the relevant parts of the input space. This leads to a marked reduction ofthe mean square error. After 40 observations the systematic part of the true function has been captured nearly perfectly. In the last phase of the experiment the algorithm merely reduces the uncertainty caused by the random noise. In contrast , the data generated randomly does not have sufficient information on the details of f(x , w), and therefore the error only gradually decreases. Because of space constraints we cannot report experiments with radial basis functions which led to similar results."
1001,"Neural Network Ensembles, Cross Validation, and Active Learning","INTRODUCTION It is well known that a combination of many different predictors can improve predictions. In the neural networks community ""ensembles"" of neural networks has been investigated by several authors, see for instance [1, 2, 3]. Most often the networks in the ensemble are trained individually and then their predictions are combined. This combination is usually done by majority (in classification) or by simple averaging (in regression), but one can also use a weighted combination of the networks. Author to whom correspondence should be addressed.This suggests the following strategy. Chose a number K :::; p. For each network in the ensemble hold out K examples for testing, where the N test sets should have minimal overlap, i. e., the N training sets should be as different as possible. If, for instance, K :::; piN it is possible to choose the K test sets with no overlap. Five identical feed-forward networks with one hidden layer of 20 units were trained independently by back-propagation using 200 random examples. For each network a cross-validation set of K examples was held out for testing as described above. Note, however, that a member of the ensemble can have such a poor generalization or be so correlated with the rest of the ensemble that it is optimal to set its weight to zero. The weights can be ""learned"" from unlabeled examples, e.g. by gradient descent minimization of the estimate of the generalization error (10). The dashed curve shows the generalization error when the weights are optimized as described above using the estimates of Ea from the cross-validation (on K exampies). Which tells us that the ambiguity is a lower bound for the weighted average of the squared error. An input pattern that yields a large ambiguity will always have a large average error. On the other hand, a low ambiguity does not necessarily imply a low error. If the individual networks are trained to a low training error on the same set of examples then both the error and the ambiguity are low on the training points. This ensures that a pattern yielding a large ambiguity cannot be in the close neighborhood of a training example. The ambiguity will to some extent follow the fluctuations in the error. Since the ambiguity is calculated from unlabeled examples the input-space can be scanned for these areas to any detail. Jesper Vedelsby This was done by training the individuals on different training sets by holding out some examples for each individual during training. This had the added advantage that these examples could be used for testing, and thereby one could obtain good estimates of the generalization error. It was discussed how to find the optimal weights for the individuals of the ensemble. For our simple test problem the weights found improved the performance of the ensemble significantly. Finally a method for active learning was described, which was based on the method of query by committee developed for classification problems. The idea is that if the ensemble disagrees strongly on an input, it would be good to find the label for that input and include it in the training set for the ensemble. It was shown how active learning improves the learning curve a lot for a simple test problem. Acknowledgements We would like to thank Peter Salamon for numerous discussions and for his implementation of linear programming for optimization of the weights. We also thank Lars Kai Hansen for many discussions and great insights, and David Wolpert for valuable comments."
1002,Using a neural net to instantiate a deformable mod,"The ink generators and background process define a mixture model. Using the assumption that each data point is generated independently given the instantiated model, P(Ilz*, M) factors into the product of the probability density of each black pixel under the mixture model. 1.2 RECOGNIZING ISOLATED DIGITS For each model, the aim of the search is to find the instantiation parameters that minimize E tot . The search starts with zero deformations and an initial guess for the affine parameters which scales the model so as to lie over the data with zero skew and rotation. A small number of generators with the same large variance are placed along the spline, forming a broad, smooth ridge of high ink-probability along the spline. 2 PREDICTING THE INSTANTIATION PARAMETERS The search procedure described above is very time consuming. However, given many examples of images and the corresponding instantiation parameters obtained by the slow method, it is possible to train a neural network to predict the instantiation parameters of novel images. These predictions provide better starting points, so the search time can be reduced. 3The schedule starts with 8 beads increasing to 60 beads in six steps, with the variance decreasing from 0.04 to 0.0006 (measured in the object frame). The parameter space for each model is divided into cells (""binned""), and then for each image feature a vote is added to each parameter space bin that could have produced that feature. After collecting votes from all image features we then search for peaks in the parameter space accumulator array, and attempt to verify pose. The Hough transform can be viewed as a crude way of approximating the logarithm of the posterior distribution P(zII, M) (e.g. Hunt et al , 1988). However, these two techniques have only been used on problems involving rigid models, and are not readily applicable to the digit recognition problem. For the Hough space method, binning and vote collection is impractical in the high dimensional parameter space, and for the correspondence based approach there is a lack of easily identified and highly discriminative features. On a validation set the squared error of the prediction net was over three times smaller than the trivial net. Although this is encouraging, the acid test is to compare the performance of elastic models settled from the predicted positions using a shortened annealing schedule; if the predictions are good, then only a short amount of settling will be required. The general trends are that the performance obtained using the prediction net is consistently better than the trivial net, and that longer annealing schedules lead to better performance. A comparison of schedules 3 and 4 in table 1 indicates that the performance of the prediction net/schedule 3 combination is similar to (or slightly better than) that obtained with the full annealing schedule, and is more than a factor of two faster. With sufficient matches it is then possible to compute the instantiation parameters of the model. We believe that using machine learning techniques like neural networks to help reduce the amount of search required to fit complex models to data may be useful for many other problems."
